{
  "$schema": "deepfield-content/1",
  "table": "balance",
  "generated": "2026-09-17T07:21:16Z",
  "sourceSha": "b44eea1",
  "rows": [
    {
      "id": "default",
      "tickHz": 30,
      "dt": 0.033333335,
      "startingLives": 20,
      "startingMoney": 250,
      "hpGrowth": 1.22,
      "bountyScale": 1,
      "bountyGrowth": 1.15,
      "scrapGrowth": 1.15,
      "packFirstCost": 50,
      "packCostGrowth": 1.5,
      "packDamagePerLevel": 1.25,
      "packRatePerLevel": 1.12,
      "packGraviumEvery": 5,
      "packGraviumPerStep": 4,
      "intermissionSeconds": 8,
      "projectileHitRadius": 0.4,
      "countScalePerExtraPlayer": 0.6,
      "hpScalePerExtraPlayer": 0.15,
      "playerMaxHp": 100,
      "playerRegenDelaySeconds": 6,
      "playerRegenPerSecond": 10,
      "reviveSeconds": 4,
      "bleedoutSeconds": 30,
      "soloRespawnSeconds": 10,
      "reviveRangeMeters": 2.5,
      "contactRadiusMeters": 1.2,
      "scrapTeamShare": 0.5,
      "forgeBuildDiscount": 0.9,
      "beamRampPerSecond": 0.6,
      "beamRampCap": 3,
      "emberBurnDurationFactor": 1.3,
      "tempestRateFactor": 1.12,
      "glacierChilledDamageFactor": 1.25,
      "sellRefundPercent": 70,
      "shieldRegenDelaySeconds": 3,
      "shieldRegenPerSecond": 8,
      "ccResistFillPerSecond": 0.45,
      "ccResistDecayPerSecond": 0.125,
      "meleeScrapBonus": 1.25,
      "meleeRepairFactor": 0.35,
      "siegeBreachBias": 0.6,
      "burrowCycleMeters": 14,
      "burrowedMeters": 8,
      "hitRangeSlack": 1.15,
      "endlessCountGrowthPerLap": 1.15,
      "endlessHpGrowth": 1.15,
      "scrapPickupSeconds": 45,
      "scrapMagnetMeters": 4.5,
      "scrapMagnetSpeed": 9,
      "scrapCollectMeters": 1.6,
      "scrapFallSpeed": 11
    }
  ]
}
